url,website_title,crawled_text,record_date,crawled_text_size,url_depth
https://www.bbc.com/,BBC - Homepage,"Homepage Accessibility links Skip to content Accessibility Help BBC Account Notifications Home News Sport Weather iPlayer Sounds CBBC CBeebies Food Bitesize Arts Taster Local Three Menu Search Search the BBCSearch the BBC BBC Homepage EU sues AstraZeneca over Covid vaccine delays The pharmaceutical giant says the legal action is ""without merit"" and vows to defend itself. Europe EU sues AstraZeneca over Covid vaccine delays PM said bodies 'could pile high' instead of lockdown UK Politics PM said bodies 'could pile high' instead of lockdown Video shows sunken sub's crew singing farewell song Asia Video shows sunken sub's crew singing farewell song The UK island waiting to be discovered Travel The UK island waiting to be discovered The high-tech condoms of the future Future The high-tech condoms of the future News US to share up to 60m AstraZeneca vaccine doses Millions of doses will be available for export in the coming months, the White House says. US & Canada US to share up to 60m AstraZeneca vaccine doses Patients suffer at home as Covid chokes hospitals India's Covid sick struggle to get treatment at home due to black marketing of oxygen and drugs. India Patients suffer at home as Covid chokes hospitals 'A person cannot even die peacefully in Delhi' India is suffering critical shortages of medical equipment and oxygen amid a devastating surge in Covid-19 cases. India 'A person cannot even die peacefully in Delhi' Sport Premier League: Leicester v Crystal Palace Follow live text updates and BBC Radio 5 Live commentary as Leicester host Crystal Palace in the Premier League. Football Premier League: Leicester v Crystal Palace Players leave IPL amid Covid-19 concerns Australians Adam Zampa, Kane Richardson and Andrew Tye return home from the IPL as India's Ravichandran Ashwin takes a break to support his family. Cricket Players leave IPL amid Covid-19 concerns Ibrahimovic investigated in betting probe Zlatan Ibrahimovic is to be investigated by Uefa over an ""alleged financial interest in a betting company"". European Football Ibrahimovic investigated in betting probe London Weather Edit Mon 3°C Tue 15°C 7°C Wed 14°C 5°C Thu 12°C 4°C Visit Reel The most amazing videos from the BBC The simple thing that instantly changes our social status Lessons on wealth from the happiest country in the world The beauty ideal fuelling an illicit drugs trade Editor’s Picks How 'digital intensity' is hurting us Virtual work is taxing our brains – so how do we fix it? Worklife How 'digital intensity' is hurting us The outrage over Vietnamese pho The culinary catastrophe had everyone up in arms Travel The outrage over Vietnamese pho The dogs that stayed in Chernobyl Pets were left behind when people fled the nuclear disaster. Some survived Future The dogs that stayed in Chernobyl Oscars 2021: 'The evening was a snooze' This year's muted ceremony made history, but remained a dull watch Culture Oscars 2021: 'The evening was a snooze' Hundreds battle for the right to use the name Josh Armed with pool noodles, the friendly fray was sparked by a viral post challenging Joshes in the US US Hundreds battle for the right to use the name Josh Non-returned Sabrina video casts criminal spell How a Sabrina the Teenage Witch videotape landed a US woman with a criminal history for decades US Non-returned Sabrina video casts criminal spell 13 major looks from the Oscars red carpet All the suits, sparkles and sequins from Sunday night's Academy Awards Entertainment & Arts 13 major looks from the Oscars red carpet Latest Business News 1 Travellers swapping summer holidays for autumn ones 2 Singapore and Hong Kong to open travel bubble 3 Shopping trips set to fuel economic rebound 4 Work at Mozambique gas project halted after attack 5 Ex-Post Office boss quits board jobs after scandal Future Planet Solutions for a sustainable world The underappreciated power of human poo A neglected protein-rich 'superfood' The world capital of the dirtiest coal New Tech Economy Business The salmon you buy in the future may be farmed on land The salmon you buy in the future may be farmed on land ADVERTISEMENT Designed Culture The gentle crafts that bring peace The gentle crafts that bring peace Featured video Returning home to a nuclear disaster zone Lyudmila Honchar was four when she had to leave her home in Pripyat, Ukraine after the Chernobyl nuclear disaster. Now she's going home. Europe Returning home to a nuclear disaster zone Recommended Most Watched Latest Returning home to a nuclear disaster zone Europe Returning home to a nuclear disaster zone Watch Oscars’ winners in three minutes Entertainment & Arts Watch Oscars’ winners in three minutes British Oscar winners celebrate success Entertainment & Arts British Oscar winners celebrate success 'Apocalyptic' landscape in aftermath of... Latin America & Caribbean 'Apocalyptic' landscape in aftermath of eruptions Crouching tiger, hidden villagers China Crouching tiger, hidden villagers Boris Johnson struggles in interview UK Boris Johnson struggles in interview Ready for the total solar eclipse? US & Canada Ready for the total solar eclipse? Koalas 'face extinction' in parts of... Australia Koalas 'face extinction' in parts of Australia Video 'shows Mosul mosque's destruction' Middle East Video 'shows Mosul mosque's destruction' Indonesia's female 'devil wheel' riders Asia Indonesia's female 'devil wheel' riders 'We do like a rave!' Inside the UK's last... UK 'We do like a rave!' Inside the UK's last lesbian bars Space junk map tracks 200 ‘ticking time... Science & Environment Space junk map tracks 200 ‘ticking time bombs’ Man jumps through car window to stop erratic... Europe Man jumps through car window to stop erratic driver BBC World Service On Air: BBC News More around the BBC Oscars audience drops to an all-time low Fewer than 10 million people watched the 2021 Oscars, which critics described as a ""trainwreck"" Entertainment & Arts Oscars audience drops to an all-time low Perth ends lockdown after Covid cases contained Australia Perth ends lockdown after Covid cases contained Nature 'more important than ever during lockdown' Science & Environment Nature 'more important than ever during lockdown' 'Shocked' man buys Google web address for £2 Technology 'Shocked' man buys Google web address for £2 Facebook and Google 'failed to remove scam adverts' Technology Facebook and Google 'failed to remove scam adverts' Hospital fire kills 82 Covid patients in Baghdad Middle East Hospital fire kills 82 Covid patients in Baghdad Line of Duty achieves record ratings Entertainment & Arts Line of Duty achieves record ratings From Our Correspondents Are allegations against PM more than tittle tattle? By Laura Kuenssberg Why holidays in Majorca could decide who runs Germany By Katya Adler Mars helicopter makes second successfully flight By Jonathan Amos Growing doubts over chip fat biofuel By Matt McGrath Super League makes financial sense for top clubs By Simon Jack Future-proofing coffee in a warming world By Helen Briggs How India failed to prevent a deadly second wave By Soutik Biswas Human cells grown in monkey embryos spark debate By Helen Briggs Technology of Business Shopping in 10 minutes: The new supermarket battle Business Shopping in 10 minutes: The new supermarket battle Creativity Collective How we're duped by the 'creative cliff' Worklife How we're duped by the 'creative cliff' World in pictures Search to find girl in docks photo 100 years on Wales Search to find girl in docks photo 100 years on Africa's top shots: Firebreathers and farewells Africa Africa's top shots: Firebreathers and farewells Covid warning signs are being photographed for history In Pictures Covid warning signs are being photographed for history In pictures: US reacts to Chauvin trial verdict In Pictures In pictures: US reacts to Chauvin trial verdict Drone image scoops garden photo award In Pictures Drone image scoops garden photo award BBC in other languages Russian Военные расходы в эпоху коронавируса: Россия в пятерке лидеров, Британия дышит ей в спину Spanish ""En los 70 Venezuela era la modernidad"": 3 colombianos que emigraron hace décadas y ya no quieren regresar (pese a la crisis) Persian واکنش‌ها به اظهارات بی‌سابقه ظریف در مصاحبه افشا شده Portuguese 'Brasil não levou pandemia a sério e muitos morreram desnecessariamente', diz Nobel de Medicina More Languages Arabic عربي Azeri AZƏRBAYCAN Bangla বাংলা Burmese မြန်မာ Chinese 中文网 French AFRIQUE Hausa HAUSA Hindi हिन्दी Indonesian INDONESIA Japanese 日本語 Kinyarwanda GAHUZA Kirundi KIRUNDI Kyrgyz Кыргыз Marathi मराठी Nepali नेपाली Pashto پښتو Persian فارسی Portuguese BRASIL Russian НА РУССКОМ Sinhala සිංහල Somali SOMALI Spanish MUNDO Swahili SWAHILI Tamil தமிழ் Turkish TÜRKÇE Ukrainian УКРАЇНСЬКA Urdu اردو Uzbek O'ZBEK Vietnamese TIẾNG VIỆT Explore the BBC Home News Sport Weather iPlayer Sounds CBBC CBeebies Food Bitesize Arts Taster Local Three Terms of Use About the BBC Privacy Policy Cookies Accessibility Help Parental Guidance Contact the BBC Get Personalised NewslettersCopyright © 2021 BBC. The BBC is not responsible for the content of external sites. Read about our approach to external linking.",Mon Apr 26 23:08:14 AZT 2021,9193,1
https://www.investopedia.com/,"Investopedia: Sharper insight, better investing.","Education General Dictionary Economics Corporate Finance Roth IRA Stocks Mutual Funds ETFs 401(k) Investing/Trading Investing Essentials Fundamental Analysis Portfolio Management Trading Essentials Technical Analysis Risk Management Markets News Company News Markets News Trading News Political News Trends Popular Stocks Apple (AAPL) Tesla (TSLA) Amazon (AMZN) AMD (AMD) Facebook (FB) Netflix (NFLX) Simulator Simulator Create an Account Join a Game My Simulator My Game Create a Game Your Money Personal Finance Wealth Management Budgeting/Saving Banking Credit Cards Home Ownership Retirement Planning Taxes Insurance Reviews & Ratings Best Online Brokers Best Savings Accounts Best Home Warranties Best Credit Cards Best Personal Loans Best Student Loans Best Life Insurance Best Auto Insurance Advisors Your Practice Practice Management Continuing Education Financial Advisor Careers Investopedia 100 Wealth Management Portfolio Construction Financial Planning Academy Popular Courses Investing for Beginners Become a Day Trader Trading for Beginners Technical Analysis Courses by Topic All Courses Trading Courses Investing Courses Financial Professional Courses Submit ESG, SRI, and Impact Investing: What's the Difference? There are distinct differences between ESG, SRI, and impact investing that clients should understand. President Joe Biden's Plan for Climate Change President Joe Biden announced a new target that calls for U.S. emissions to be 50% to 52% lower in 2030 than levels in 2005. How Bitcoin Works What you need to know about this cryptocurrency Mortgage Calculator Understand your monthly payments U.S. Consumer Debt Trends How consumer debt changed during the pandemic Quarterly Earnings Report It's earnings season. What does that mean? The Racial Gap in Financial Literacy Why it matters Best Pet Insurance Plans Find the right coverage What do you need to learn today? Search Stock Simulator Compete risk free with $100,000 in virtual cash. Get Started Investopedia Academy Self-paced, online courses from expert instructors. View Courses The Market Sum The news and analysis you need after the closing bell. Sign Up Now Featured Key Strategies for Advising Clients Through Volatility Portfolio Diversification: An Investor's Guide All Special Features How To Calculate Return On Investment (ROI) Performance Chasing Can Cost You Ray Dalio breaks down his ""Holy Grail"" Law of Supply and Demand The law of supply and demand explains the interaction between the supply of and demand for a resource, and the effect on its price. Read more Subscribe to 'term of the day' and learn a new financial term every day. Stay informed and make smart financial decisions. SIGN UP NOW Exchange Traded Fund – ETFs Budget Financial Industry Regulatory Authority (FINRA) Sustainability Social Security Relative Strength About Us Terms of Use Dictionary Editorial Policy Advertise News Privacy Policy Contact Us Careers California Privacy Notice # A B C D E F G H I J K L M N O P Q R S T U V W X Y Z Investopedia is part of the Dotdash publishing family.",Mon Apr 26 23:08:14 AZT 2021,3065,1
https://www.ebay.com/,"Electronics, Cars, Fashion, Collectibles & More | eBay","Skip to main content Shop by category Shop by category Enter your search keyword All Categories Advanced Hi (Sign in to bid or buy) Daily Deals Help & Contact Ship to Loading... Error: Try AgainOk Sell WatchlistExpand Watch List Loading... Sign in to see your user information My eBayExpand My eBay Summary Recently Viewed Bids/Offers Watchlist Purchase History Buy Again Selling Saved Searches Saved Sellers Messages Notification Expand Cart Loading... Something went wrong. View cart for details. Home Saved Electronics Expand: Electronics Most popular categories Cell phones and accessories Video games and consoles Computers and tablets Cameras and photos Camera drones Asian Brands Smart home More categories Apple Samsung Xiaomi Portable audio and headphones Smart watches Deals Sell on eBay Fashion Expand: Fashion Most popular categories Footwear Women's clothing Footwear for women Clothes for men Men's footwear Watches Jewelry More categories Accessories for men Accessories for women Bags and wallets for women Mens sunglasses Womens sunglasess Sneakers Deals Sell on eBay Health & Beauty Expand: Health & Beauty Most popular categories Beauty Makeup Health K-Beauty Manicure and pedicure Hair products Skin products Orthopedic products More categories Vitamins and food supplements Shaving and waxing Bath and personal hygiene Oral hygiene Massagers Deals Sell on eBay Home & Garden Expand: Home & Garden Most popular categories Workshop Tools and Equipment Patio, garden and outdoors Home improvement Kitchen, dining and bar Lamps, lights and fans Interior decoration Home organization Home appliances More categories Toys Pets Crafts Art supplies Musical instruments Jewelry and beads Deals Sell on eBay Sports Expand: Sports Most popular categories Cycling Fitness, running and yoga Fitness Tech Fishing Camping Scooters Team sports More categories Watersports Winter sports Box and MMA Swimming GPS & Running Watches Garmin Deals Sell on eBay Collectibles and Art Expand: Collectibles and Art Most popular categories Collectibles Art Action figures Cartoon characters Movie and TV characters Diecast Musical memorabilia More categories Sports memorabilia Trading card games Antiques Comics Funko pop Deals Sell on eBay Industrial equipment Expand: Industrial equipment Most popular categories Dental healthcare Electronic equipment and supplies Metallurgy and manufacturing Motors and industrial automation Heavy equipment parts Light industrial tools Inspection, measurement and testing equipment More categories Packing and shipping Office supplies and equipment Printing and graphic arts Restaurants and food service Maintenance and safety Retail and services Deals Sell on eBay Motors Expand: Motors Car Auto and truck parts Tools and supplies Turbo chargers Clothing and merchandise Shock absorbers Electronic and GPS Car Care and Detailing Vintage pieces Motorcycle and Offers Motorcycle parts Body and frame Engines and parts Accessories Exhausts and systems Rims Deals Sell on eBay Deals Sell Expand: Sell Create listing Apply as a business Seller center More Expand: More ElectronicsFashionHealth & BeautyHome & GardenSportsCollectibles and ArtIndustrial equipmentMotorsDealsSell You Deserve a Deal Save 10% on selected items in Fashion, Tech and Home & Garden PXGBH10 PXGBH10 - PXGBH10 *Max discount $50, 50x use. See T&Cs Explore Popular Categories Sneakers Korean beauty Wristwatches Fishing Collectibles Smartphones Sell Daily Deals - Carousel See all Carousel showing slide 1 of 3 - Daily Deals $11.88 $6.99 $26.13 $17.09 Previous Price: $17.99·5% OFF $39.59 Previous Price: $59.98·34% OFF $8.49 Previous Price: $9.43·10% OFF $5.38 $29.94 $12.77 Previous Price: $14.85·14% OFF $13.48 Previous Price: $15.68·14% OFF $5.56 $299.99 $129.00 $7.49 $6.91 Explore popular categories See all Explore popular categories Apple Samsung Sony Ugreen Xiaomi Nike Born Pretty Additional site navigation Buy Registration eBay Money Back Guarantee Bidding & buying help Stores eBay Local eBay guides Sell Start selling Learn to sell Business sellers Affiliates Tools & apps Developers Security center eBay official time Site map eBay companies eBay Classifieds Close5 See all companies Stay connected eBay's Blogs Facebook Twitter About eBay Company info News Investors Careers Government relations Advertise with us Policies Verified Rights Owner (VeRO) Program Help & Contact Resolution Center Seller Information Center Contact us Community Announcements Answer center Discussion boards eBay Giving Works Groups eBay top shared eBay Sites United States Argentina Australia Austria Belarus Belgium Bolivia Brazil Canada Chile China Colombia Costa Rica Dominican Republic Ecuador El Salvador France Germany Guatemala Honduras Hong Kong India Ireland Israel Italy Japan Kazakhstan Korea Malaysia Mexico Netherlands Nicaragua Panama Paraguay Peru Philippines Poland Portugal Puerto Rico Russia Singapore Spain Switzerland Taiwan Turkey United Kingdom Uruguay Venezuela About eBay Announcements Community Security Center Resolution Center Seller Information Center Policies Affiliates Help & Contact Site Map Copyright © 1995-2021 eBay Inc. All Rights Reserved. Accessibility, User Agreement, Privacy, Cookies, Do not sell my personal information and AdChoice Norton Secured - powered by Verisign",Mon Apr 26 23:08:14 AZT 2021,5307,1
